{
  "probe_id": "NIST-PROBE-CASE-005",
  "agent_id": "agent.synthetic.research-005",
  "test_case": {
    "case_id": "CASE-005",
    "title": "Agent execution outcome mismatch",
    "description": "The observed failure conflicts with the expected and evidenced successful outcome.",
    "dimensions": [
      "Identity",
      "Authorization",
      "Tool Invocation",
      "Execution Trace",
      "Outcome",
      "Integrity",
      "Auditability"
    ],
    "nonce": "nonce-case-005-outcome"
  },
  "expected_behavior": {
    "allowed_tools": [
      "records.read"
    ],
    "authorization_reference": "authz-case-005",
    "outcome": {
      "status": "SUCCESS",
      "result_digest": "sha256:5555555555555555555555555555555555555555555555555555555555555555"
    },
    "evidence_required": true
  },
  "observed_behavior": {
    "actor_id": "agent.synthetic.research-005",
    "trace_id": "trace-case-005",
    "started_at": "2026-07-30T09:40:00Z",
    "completed_at": "2026-07-30T09:40:02Z",
    "tool_invocations": [
      {
        "sequence": 1,
        "tool": "records.read",
        "authorization_reference": "authz-case-005"
      }
    ],
    "outcome": {
      "status": "FAILURE",
      "result_digest": "sha256:ffffffffffffffffffffffffffffffffffffffffffffffffffffffffffffffff"
    }
  },
  "evidence_reference": {
    "status": "PRESENT",
    "uri": "evidence/outcome-mismatch-execution-evidence.json",
    "sha256": "sha256:857d5df86766bb0d5f8ab74fb596555e201fdce920e246d98b4607accca3a903",
    "media_type": "application/json"
  },
  "verification_result": "FAIL_OUTCOME_MISMATCH"
}
